{
  "schemaVersion": 1,
  "eventId": "evt-jira-status-reminder-1",
  "occurredAt": "2026-07-24T20:20:00Z",
  "eventType": "work-item.comment.requested",
  "summary": "Post a status reminder to the AEPI test task.",
  "executionMode": "agent",
  "actorId": "coordination-agent",
  "source": {
    "surface": "routing-fabric-fixture",
    "repository": "agentic-engineering-platform",
    "workItem": "AEPI-10"
  },
  "correlationId": "aepi-status-reminder-loop",
  "hopCount": 1,
  "artifacts": [],
  "proposedAction": {
    "actionType": "append",
    "destination": "jira",
    "target": "AEPI-10:comments",
    "intent": "post-unchanged-status-reminder"
  }
}
