{
  "schemaVersion": 1,
  "eventId": "evt-case-study-category-removal",
  "occurredAt": "2026-07-24T20:00:00Z",
  "eventType": "repository.taxonomy.changed",
  "summary": "Removed the case-study knowledge category and relocated its substantive note.",
  "executionMode": "hybrid",
  "actorId": "codex-and-julian",
  "source": {
    "surface": "codex-chat",
    "repository": "engineering-knowledge-base"
  },
  "correlationId": "knowledge-tree-audience-first-migration",
  "causationId": "human-request-remove-case-study-category",
  "hopCount": 0,
  "artifacts": [
    {
      "type": "git-commit",
      "ref": "6863bfb"
    }
  ]
}
